[
  {
    "input": "Explain a concept at the right level",
    "context": {},
    "output": "{\"action\": \"call\", \"tool\": \"web_search\", \"args\": {\"query\": \"example search query\"}}",
    "category": "core"
  },
  {
    "input": "Use llm call",
    "context": {},
    "output": "{\"action\": \"call\", \"tool\": \"llm_call\", \"args\": {\"input\": \"example\"}}",
    "category": "core"
  },
  {
    "input": "Use web search with empty input",
    "context": {},
    "output": "{\"action\": \"call\", \"tool\": \"web_search\", \"args\": {}}",
    "category": "edge"
  },
  {
    "input": "Run web search with maximum values",
    "context": {},
    "output": "{\"action\": \"call\", \"tool\": \"web_search\", \"args\": {\"query\": \"example search query\"}}",
    "category": "boundary"
  },
  {
    "input": "Do something completely unrelated to this nerve",
    "context": {},
    "output": "{\"action\": \"error\", \"tool\": \"web_search\", \"args\": {}, \"error\": \"Request does not match available tools\"}",
    "category": "negative"
  }
]
